title,authors,description,published_date
The Fire Next Time,James Baldwin,NA,1985
Notes of a Native Son,James Baldwin,"Originally published in 1955, James Baldwin's first nonfiction book has become a classic. These searing essays on life in Harlem, the protest novel, movies, and Americans abroad remain as powerful today as when they were written. ""He named for me the things you feel but couldn't utter. . . . Jimmy's essays articulated for the first time to white America what it meant to be American and a black American at the same time."" -Henry Louis Gates, Jr.",1984
Conversations with James Baldwin,James Baldwin,"Selected interviews with the American writer shares his observations on his life and career, politics, Civil Rights, and the role of the artist",1989
If Beale Street Could Talk,James Baldwin,"In this honest and stunning novel, now a major motion picture directed by Barry Jenkins, James Baldwin has given America a moving story of love in the face of injustice. Told through the eyes of Tish, a nineteen-year-old girl, in love with Fonny, a young sculptor who is the father of her child, Baldwin’s story mixes the sweet and the sad. Tish and Fonny have pledged to get married, but Fonny is falsely accused of a terrible crime and imprisoned. Their families set out to clear his name, and as they face an uncertain future, the young lovers experience a kaleidoscope of emotions–affection, despair, and hope. In a love story that evokes the blues, where passion and sadness are inevitably intertwined, Baldwin has created two characters so alive and profoundly realized that they are unforgettably ingrained in the American psyche.",2013-09-17
James Baldwin: The Last Interview,James Baldwin,"Never before available, the unexpurgated last interview with James Baldwin “I was not born to be what someone said I was. I was not born to be defined by someone else, but by myself, and myself only.” When, in the fall of 1987, the poet Quincy Troupe traveled to the south of France to interview James Baldwin, Baldwin’s brother David told him to ask Baldwin about everything—Baldwin was critically ill and David knew that this might be the writer’s last chance to speak at length about his life and work. The result is one of the most eloquent and revelatory interviews of Baldwin’s career, a conversation that ranges widely over such topics as his childhood in Harlem, his close friendship with Miles Davis, his relationship with writers like Toni Morrison and Richard Wright, his years in France, and his ever-incisive thoughts on the history of race relations and the African-American experience. Also collected here are significant interviews from other moments in Baldwin’s life, including an in-depth interview conducted by Studs Terkel shortly after the publication of Nobody Knows My Name. These interviews showcase, above all, Baldwin’s fearlessness and integrity as a writer, thinker, and individual, as well as the profound struggles he faced along the way.",2014-12-02
Collected Essays,James Baldwin,"A comprehensive compilation of Baldwin's previously published, nonfiction writings encompasses essays on America's racial divide, the social and political turbulence of his time, and his insights into the poetry of Langston Hughes and the music of Earl Hines.",1998
Go tell it on the mountain : [a novel],James Baldwin,This novel of Black life in America is written with an impartial attitude,1985
No Name in the Street,James Baldwin,"This stunningly personal document and extraordinary history of the turbulent sixties and early seventies displays James Baldwin's fury and despair more deeply than any of his other works. In vivid detail he remembers the Harlem childhood that shaped his early conciousness, the later events that scored his heart with pain--the murders of Martin Luther King and Malcolm X, his sojourns in Europe and in Hollywood, and his retum to the American South to confront a violent America face-to-face.",2013-09-17
James Baldwin in Context,D. Quentin Miller,"James Baldwin in Context provides a wide-ranging collection of approaches to the work of an essential black American author who is just as relevant now as he was during his turbulent heyday in the mid-twentieth century. The perspectives range from those who knew Baldwin personally, to scholars who have dedicated decades to studying him, to a new generation of scholars for whom Baldwin is nearly a historical figure. This collection complements the ever-growing body of scholarship on Baldwin by combining traditional inroads into his work, such as music and expatriation, with new approaches, such as intersectionality and the Black Lives Matter movement.",2019-08-01
Vintage Baldwin,James Baldwin,"An anthology of writings by the great African-American writer includes short stories, essays, and novel and play exerpts, including such works as ""Sonny's Blues,"" ""Emancipation"" from The Fire Next Time, ""The Discovery of What It Means to Be an American,"" and selections from Another Country. Original. 25,000 first printing.",2004
The Devil Finds Work,James Baldwin,"James Baldwin At The Movies... Provocative, timeless, brilliant. Bette Davis's eyes, Joan Crawford's bitchy elegance, Stepin Fetchit's stereotype, Sidney Poitier's superhuman black man... These are the movie stars and the qualities that influenced James Baldwin... and now become part of his incisive look at racism in American movies. Baldwin challenges the underlying assumptions in such films as In the Heat of the Night, Guess Who's Coming to Dinner, and The Exorcist, offering us a vision of America's self-delusions and deceptions. Here are our loves and hates, biases and cruelties, fears and ignorance reflected by the films that have entertained us and shaped our consciousness. And here, too, is the stunning prose of a writer whose passion never diminished his struggle for equality, justice, and social change. From The Birth of a Nation to The Exorcist--one of America's most important writers turns his critical eye to American film.",2013-09-17
Understanding James Baldwin,Marc Dudley,"The Harlem-born son of a storefront preacher, James Baldwin died almost thirty years ago, but his spirit lives on in the eloquent and still-relevant musings of his novels, short stories, essays, and poems. What concerned him most—as a black man, as a gay man, as an American—were notions of isolation and disconnection at both the individual and communal level and a conviction that only in the transformative power of love could humanity find any hope of healing its spiritual and social wounds. In Understanding James Baldwin, Marc K. Dudley shows that a proper grasp of Baldwin’s work begins with a grasp of the times in which he wrote. During a career spanning the civil rights movement and beyond, Baldwin stood at the heart of intellectual and political debate, writing about race, sexual identity, and gendered politics, while traveling the world to promote dialogue on those issues. In surveying the writer’s life, Dudley traces the shift in Baldwin’s aspirations from occupying the pulpit like his stepfather to becoming a writer amid the turmoil of sexual self-discovery and the harsh realities of American racism and homophobia. The book’s analyses of key works in the Baldwin canon—among them, Go Tell It on the Mountain, Giovanni’s Room, “Sonny’s Blues,” Another Country, The Fire Next Time, and The Devil Finds Work—demonstrate the consistency, contrary to some critics’ claims, of Baldwin’s vision and thematic concerns. As police violence against people of color, a resurgence in white supremacist rhetoric, and pushback against LGBTQ rights fill today’s headlines, James Baldwin’s powerful and often-angry words find a new resonance. From early on, Baldwin decried the damning potential of alienation and the persistent bigotry that feeds it. Yet, even as it sometimes wavered, his hope for both the individual and the nation remained intact. In the present historical moment, James Baldwin matters more than ever.",2019-04-17
The Fire Next Time,James Baldwin,"A national bestseller when it first appeared in 1963, The Fire Next Time galvanized the nation and gave passionate voice to the emerging civil rights movement. At once a powerful evocation of James Baldwin's early life in Harlem and a disturbing examination of the consequences of racial injustice, the book is an intensely personal and provocative document. It consists of two ""letters,"" written on the occasion of the centennial of the Emancipation Proclamation, that exhort Americans, both black and white, to attack the terrible legacy of racism. Described by The New York Times Book Review as ""sermon, ultimatum, confession, deposition, testament, and chronicle...all presented in searing, brilliant prose,"" The Fire Next Time stands as a classic of our literature.",2013-09-17
James Baldwin,Lisa Rosset,"After writing several controversial articles about racism in America, Baldwin moved to Europe and started a career in novel writing. His impassioned style of writing conveyed an urgent need for change in the black ghetto life and he came to be looked upon as the leading spokesman on racial affairs.",1990
Another Country,James Baldwin,"Classic fiction. This masterly story of desire, hatred and violence opens with the unforgettable character of Rufus Scott, a scavenging Harlem jazz musician adrift in New York. Self-destructive, bad and brilliant, he draws us into a Bohemian underworld pulsing with heat, music and sex, where desperate and dangerous characters betray, love and test each other to the limit.",1963
The Chicken Salad Club,Marsha Diane Arnold,"Nathaniel's great-grandfather, who is 100 years old, loves to tell stories from his past but seeks someone to join him with a new batch of stories.",1998
James Baldwin,David Leeming,"James Baldwin was one of the great writers of the last century. In works that have become part of the American canon—Go Tell It on a Mountain, Giovanni’s Room, Another Country, The Fire Next Time, and The Evidence of Things Not Seen—he explored issues of race and racism in America, class distinction, and sexual difference. A gay, African American writer who was born in Harlem, he found the freedom to express himself living in exile in Paris. When he returned to America to cover the Civil Rights movement, he became an activist and controversial spokesman for the movement, writing books that became bestsellers and made him a celebrity, landing him on the cover of Time. In this biography, which Library Journal called “indispensable,” David Leeming creates an intimate portrait of a complex, troubled, driven, and brilliant man. He plumbs every aspect of Baldwin’s life: his relationships with the unknown and the famous, including painter Beauford Delaney, Richard Wright, Lorraine Hansberry, Marlon Brando, Harry Belafonte, Lena Horne, and childhood friend Richard Avedon; his expatriate years in France and Turkey; his gift for compassion and love; the public pressures that overwhelmed his quest for happiness, and his passionate battle for black identity, racial justice, and to “end the racial nightmare and achieve our country.” Skyhorse Publishing, along with our Arcade, Good Books, Sports Publishing, and Yucca imprints, is proud to publish a broad range of biographies, autobiographies, and memoirs. Our list includes biographies on well-known historical figures like Benjamin Franklin, Nelson Mandela, and Alexander Graham Bell, as well as villains from history, such as Heinrich Himmler, John Wayne Gacy, and O. J. Simpson. We have also published survivor stories of World War II, memoirs about overcoming adversity, first-hand tales of adventure, and much more. While not every title we publish becomes a New York Times bestseller or a national bestseller, we are committed to books on subjects that are sometimes overlooked and to authors whose work might not otherwise find a home.",2015-02-24
James Baldwin,Harold Bloom,A collection of essays presenting critiques and analysis of the major works of the African American author.,2007-01-01
The Cross of Redemption,James Baldwin,"A treasury of essays, articles and reviews by the late author of Giovanni's Room includes pieces that explore such topics as religious fundamentalism, Russian literature and the possibility of an African-American president.",2011
School Reading by Grades,James Baldwin,NA,1897
James Baldwin,Ted Gottfried,"Discusses Baldwin's childhood in Harlem, his expatriate experiences, and his return to the U.S. in the 1960s to work for the Civil Rights movement",1997
Later Novels,James Baldwin,"James Baldwin established himself as the indispensable voice of the Civil Rights era, a figure whose prophetic exploration of the racial and sexual fissures in American society raised the consciousness of American readers. This new Library of America volume see's three of Baldwin's later novels collected for the first time; Tell Me How Long the Train's Been Gone (1968), If Beale Street Could Talk (1974) and Just Above My Head (1979).",2015
Another Country,James Baldwin,"Classic fiction. This masterly story of desire, hatred and violence opens with the unforgettable character of Rufus Scott, a scavenging Harlem jazz musician adrift in New York. Self-destructive, bad and brilliant, he draws us into a Bohemian underworld pulsing with heat, music and sex, where desperate and dangerous characters betray, love and test each other to the limit.",1963
The Chicken Salad Club,Marsha Diane Arnold,"Nathaniel's great-grandfather, who is 100 years old, loves to tell stories from his past but seeks someone to join him with a new batch of stories.",1998
James Baldwin,David Leeming,"James Baldwin was one of the great writers of the last century. In works that have become part of the American canon—Go Tell It on a Mountain, Giovanni’s Room, Another Country, The Fire Next Time, and The Evidence of Things Not Seen—he explored issues of race and racism in America, class distinction, and sexual difference. A gay, African American writer who was born in Harlem, he found the freedom to express himself living in exile in Paris. When he returned to America to cover the Civil Rights movement, he became an activist and controversial spokesman for the movement, writing books that became bestsellers and made him a celebrity, landing him on the cover of Time. In this biography, which Library Journal called “indispensable,” David Leeming creates an intimate portrait of a complex, troubled, driven, and brilliant man. He plumbs every aspect of Baldwin’s life: his relationships with the unknown and the famous, including painter Beauford Delaney, Richard Wright, Lorraine Hansberry, Marlon Brando, Harry Belafonte, Lena Horne, and childhood friend Richard Avedon; his expatriate years in France and Turkey; his gift for compassion and love; the public pressures that overwhelmed his quest for happiness, and his passionate battle for black identity, racial justice, and to “end the racial nightmare and achieve our country.” Skyhorse Publishing, along with our Arcade, Good Books, Sports Publishing, and Yucca imprints, is proud to publish a broad range of biographies, autobiographies, and memoirs. Our list includes biographies on well-known historical figures like Benjamin Franklin, Nelson Mandela, and Alexander Graham Bell, as well as villains from history, such as Heinrich Himmler, John Wayne Gacy, and O. J. Simpson. We have also published survivor stories of World War II, memoirs about overcoming adversity, first-hand tales of adventure, and much more. While not every title we publish becomes a New York Times bestseller or a national bestseller, we are committed to books on subjects that are sometimes overlooked and to authors whose work might not otherwise find a home.",2015-02-24
James Baldwin,Harold Bloom,A collection of essays presenting critiques and analysis of the major works of the African American author.,2007-01-01
School Reading by Grades,James Baldwin,NA,1897
James Baldwin,"A. Scott Henderson,Paul Lee Thomas","""The recognition and study of African American (AA) artists and public intellectuals often include Martin Luther King, Jr., and occasionally Booker T. Washington, W.E.B. DuBois, and Malcolm X. The literary canon also adds Ralph Ellison, Richard White, Langston Hughes, and others such as female writers Zora Neale Hurston, Maya Angelou, and Alice Walker. Yet, the acknowledgement of AA artists and public intellectuals tends to skew the voices and works of those included toward normalized portrayals that fit wellwithin foundational aspects of the American myths refl ected in and perpetuated by traditional schooling. Further, while many AA artists and public intellectuals are distorted by mainstream media, public and political characterizations, and the curriculum, several powerful AA voices are simply omitted, ignored, including James Baldwin. This edited volume gathers a collection of essays from a wide range of perspectives that confront Baldwin’s impressive and challenging canon as well as his role as a public intellectual. Contributors also explore Baldwin as a confrontational voice during his life and as an enduring call for justice.""",2014-05-05
"Little Man, Little Man",James Baldwin,"Now available for the first time in nearly forty years, James Baldwin's only children's book Little Man, Little Man follows the day to day life of the four year old protagonist TJ and his friends in their 1970s Harlem neighborhood as they encounter the social realities of being black in America.",2018
Nobody Knows My Name,James Baldwin,"Baldwin's early essays have been described as 'an unequalled meditation on what it means to be black in America' . This rich and stimulating collection contains 'Fifth Avenue, Uptown: a Letter from Harlem', polemical pieces on the tragedies inflicted by racial segregation and a poignant account of his first journey to 'the Old Country' , the southern states. Yet equally compelling are his 'Notes for a Hypothetical Novel' and personal reflections on being American, on oother major artists - Ingmar Bergman and Andre Gide, Norman Mailer and Richard Wright - and on the first great conferance of Negro - American writers and artists in Paris. In his introduction Baldwin descrides the writer as requiring 'every ounce of stamina he can summon to attempt to look on himself and the world as they are' ; his uncanny ability to do just that is proclaimed on every page of this famous book.",1991-08-29
Come Out the Wilderness,James Baldwin,"A Vintage Shorts “Short Story Month” Selection James Baldwin’s commanding prose remains as pressing in its compassionate portrayal of marginalized figures today as it was during the peak of the Civil Rights Movement. In “Come Out the Wilderness,” an essential and tremendous classic of American literature, Baldwin unmasks the heartbreak of one African American woman’s spiritual, sexual, moral, and ultimately futile struggle for control of her future and her happiness in mid-century New York. An ebook short.",2016-05-15
I Am Not Your Negro,James Baldwin,"Transcript of the documentary film, I am not your negro, by Raoul Peck composed of unpublished and published writings, interviews, and letters by James Baldwin on the subject of racism in America.",2017
Giovanni's Room,James Baldwin,"When David meets the sensual Giovanni in a bohemian bar, he is swept into a passionate love affair. But his girlfriend's return to Paris destroys everything. Unable to admit to the truth, David pretends the liaison never happened - while Giovanni's life descends into tragedy. United by the theme of love, the writings in the Great Loves series span over two thousand years and vastly different worlds. Readers will be introduced to love's endlessly fascinating possibilities and extremities: romantic love, platonic love, erotic love, gay love, virginal love, adulterous love, parental love, filial love, nostalgic love, unrequited love, illicit love, not to mention lost love, twisted and obsessional love . . . .",2007
James Baldwin,William J. Maxwell,"Available in book form for the first time, the FBI's secret dossier on the legendary and controversial writer. Decades before Black Lives Matter returned James Baldwin to prominence, J. Edgar Hoover’s FBI considered the Harlem-born author the most powerful broker between black art and black power. Baldwin’s 1,884-page FBI file, covering the period from 1958 to 1974, was the largest compiled on any African American artist of the Civil Rights era. This collection of once-secret documents, never before published in book form, captures the FBI’s anxious tracking of Baldwin’s writings, phone conversations, and sexual habits—and Baldwin’s defiant efforts to spy back at Hoover and his G-men. James Baldwin: The FBI File reproduces over one hundred original FBI records, selected by the noted literary historian whose award-winning book, F.B. Eyes: How J. Edgar Hoover’s Ghostreaders Framed African American Literature, brought renewed attention to bureau surveillance. William J. Maxwell also provides an introduction exploring Baldwin's enduring relevance in the time of Black Lives Matter along with running commentaries that orient the reader and offer historical context, making this book a revealing look at a crucial slice of the American past—and present.",2017-06-06
James Baldwin,James Tackach,"Discusses the life of James Baldwin, his activism in civil rights, and the importance of his writings.",1996
Nothing Personal: Nothing personal,"James Baldwin,Hilton Als","This meticulous reprint of Richard Avedon and James Baldwin's searing monograph, Nothing Personal, explores the contradictions at the heart of American experience, juxtaposing subjects from Marilyn Monroe and Allen Ginsberg to mental asylum patients and the American Nazi party. A 72-page booklet features outtakes, correspondence, ephemera, and an essay by Pulitzer Prize winner Hilton Als. ""If a society permits one portion of its citizenry to be menaced or destroyed,... no one in that society is safe. The forces thus released in the people can never be held in check, but run their devouring course."" -- James Baldwin, Nothing Personal",2017
Nobody Knows My Name,James Baldwin,"Told with Baldwin's characteristically unflinching honesty, this collection of illuminating, deeply felt essays examines topics ranging from race relations in the United States to the role of the writer in society, and offers personal accounts of Richard Wright, Norman Mailer and other writers.",2013-09-17
"A Study Guide for James Baldwin's ""Notes of a Native Son""","Gale, Cengage Learning","A Study Guide for James Baldwin's ""Notes of a Native Son,"" excerpted from Gale's acclaimed Nonfiction Classics for Students. This concise study guide includes plot summary; character analysis; author biography; study questions; historical context; suggestions for further reading; and much more. For any literature project, trust Nonfiction Classics for Students for all of your research needs.",2016
Another Country,James Baldwin,"Nominated as one of America’s best-loved novels by PBS’s The Great American Read Set in Greenwich Village, Harlem, and France, among other locales, Another Country is a novel of passions--sexual, racial, political, artistic--that is stunning for its emotional intensity and haunting sensuality, depicting men and women, blacks and whites, stripped of their masks of gender and race by love and hatred at the most elemental and sublime.",2013-09-17
James Baldwin,Bill Mullen,"In the first major biography of Baldwin in more than a decade, Bill V. Mullen celebrates the personal and political life of the great African-American writer who changed the face of Western politics and culture.As a lifelong anti-imperialist, black queer advocate, and feminist, Baldwin (1924-1987) was a passionate chronicler of the rise of the Civil Rights Movement, the U.S. war against Vietnam, Palestinian liberation struggle, and the rise of LGBTQ rights.Mullen explores how Baldwin's life and work channel the long history of African-American freedom struggles, and explains how Baldwin both predicted and has become a symbol of the global Black Lives Matter movement.",2019
