title,authors,description,published_date
James Baldwin,"Bill Schwarz,Cora Kaplan","""This fine collection of essays represents an important contribution to the rediscovery of Baldwin's stature as essayist, novelist, black prophetic political voice, and witness to the Civil Rights era. The title provides an excellent thematic focus. He understood both the necessity, and the impossibility, of being a black 'American' writer. He took these issues 'Beyond'---Paris, Istanbul, various parts of Africa---but this formative experience only returned him to the unresolved dilemmas. He was a fine novelist and a major prophetic political voice. He produced some of the most important essays of the twentieth century and addressed in depth the complexities of the black political movement. His relative invisibility almost lost us one of the most significant voices of his generation. This welcome 'revival' retrieves it. Close call."" ---Stuart Hall, Professor Emeritus, Open University This interdisciplinary collection by leading writers in their fields brings together a discussion of the many facets of James Baldwin, both as a writer and as the prophetic conscience of a nation. The core of the volume addresses the shifting, complex relations between Baldwin as an American—“as American as any Texas GI” as he once wryly put it—and his life as an itinerant cosmopolitan. His ambivalent imaginings of America were always mediated by his conception of a world “beyond” America: a world he knew both from his travels and from his voracious reading. He was a man whose instincts were, at every turn, nurtured by America; but who at the same time developed a ferocious critique of American exceptionalism. In seeking to understand how, as an American, he could learn to live with difference—breaking the power of fundamentalisms of all stripes—he opened an urgent, timely debate that is still ours. His America was an idea fired by desire and grief in equal measure. As the authors assembled here argue, to read him now allows us to imagine new possibilities for the future. With contributions by Kevin Birmingham, Douglas Field, Kevin Gaines, Briallen Hopper, Quentin Miller, Vaughn Rasberry, Robert Reid-Pharr, George Shulman, Hortense Spillers, Colm Tóibín, Eleanor W. Traylor, Cheryl A. Wall, and Magdalena Zaborowska.",2011-10-05
I Know Why the Caged Bird Sings,Maya Angelou,"Here is a book as joyous and painful, as mysterious and memorable, as childhood itself. I Know Why the Caged Bird Sings captures the longing of lonely children, the brute insult of bigotry, and the wonder of words that can make the world right. Maya Angelou’s debut memoir is a modern American classic beloved worldwide. Sent by their mother to live with their devout, self-sufficient grandmother in a small Southern town, Maya and her brother, Bailey, endure the ache of abandonment and the prejudice of the local “powhitetrash.” At eight years old and back at her mother’s side in St. Louis, Maya is attacked by a man many times her age—and has to live with the consequences for a lifetime. Years later, in San Francisco, Maya learns that love for herself, the kindness of others, her own strong spirit, and the ideas of great authors (“I met and fell in love with William Shakespeare”) will allow her to be free instead of imprisoned. Poetic and powerful, I Know Why the Caged Bird Sings will touch hearts and change minds for as long as people read. “I Know Why the Caged Bird Sings liberates the reader into life simply because Maya Angelou confronts her own life with such a moving wonder, such a luminous dignity.”—James Baldwin From the Paperback edition.",2010-07-21
James Baldwin,Glynnis Reed,"The connection between American whites and blacks is far deeper and more passionate than any of us like to think. These words from the introduction of his collection of essays in ""Nobody Knows My Name"" shows the truth-telling strength of a brave man. James Baldwin was an outspoken advocate for social justice and equality for black people in America. He lent a creative and powerful voice to the civil rights struggle of the 1960s and brilliantly critiqued the problems of race in the twentieth century. Through his novels, plays, poetry, and essays, Baldwin urged the world to understand and appreciate the humanity and complexity of African Americans. This thought-provoking biography analyzes the life behind this creative force and will inspire your readers to be true to themselves and strong of conviction.",2019-12-15
James Baldwin,Quincy Troupe,NA,1989
A Historical Guide to James Baldwin,Douglas Field,"With contributions from major scholars of African American literature, history, and cultural studies, A Historical Guide to James Baldwin focuses on the four tumultous decades that defined the great author's life and art. Providing a comprehensive examination of Baldwin's varied body of work that includes short stories, novels, and polemical essays, this collection reflects the major events that left an indelible imprint on the iconic writer: civil rights, black nationalism and the struggle for gay rights in the pre- and post-Stonewall eras. The essays also highlight Baldwin's under-studied role as a trans-Atlantic writer, his lifelong struggle with faith, and his use of music, especially the blues, as a key to unlock the mysteries of his identity as an exile, an artist, and a black American in a racially hostile era.",2009
Re-viewing James Baldwin,Daniel Quentin Miller,"This new collection of essays presents a critical reappraisal of James Baldwin's work, looking beyond the commercial and critical success of some of Baldwin's early writings such as Go Tell it on the Mountain and Notes of a Native Son. Focusing on Baldwin's critically undervalued early works and the virtually neglected later ones, the contributors illuminate little-known aspects of this daring author's work and highlight his accomplishments as an experimental writer. Attentive to his innovations in style and form, Things Not Seen reveals an author who continually challenged cultural norms and tackled matters of social justice, sexuality, and racial identity. As volume editor D. Quentin Miller notes, ""what has been lost is a complete portrait of [Baldwin's] tremendously rich intellectual journey that illustrates the direction of African-American thought and culture in the late twentieth century."" This is an important book for anyone interested in Baldwin's work. It will engage readers interested in literature and African-American Studies. Author note: D. Quentin Miller is Assistant Professor of English at Gustavus Adolphus College, Saint Peter, MN.",2000
James Baldwin,Carolyn Wedin Sylvander,"Studying all of Baldwin's writings--from his early essaysto Just Above My Head, his latest novel--Sylvander shows how Balwin has drawn on his early struggles to produce a passionate and humane body of work.",1980
Fifty Famous People,James Baldwin,NA,1912
Go Tell It on the Mountain,James Baldwin,"""A hardcover edition of James Baldwin's classic coming-of-age novel set in Harlem in the 1930s, with a new introduction by Edwidge Danticat""--",2016
The Story of Roland,James Baldwin,NA,1888
Just Above My Head,James Baldwin,"Love and courage bind three extraordinary people--a former child evangelist, a famous gospel singer, and the latter's manager-brother--as they shape and are shaped by the events of the past three decades.",2000
English Language and Literary Criticism: English poetry,James Baldwin,NA,1882
Baldwin - Collected Essays,James Baldwin,"Offers a comprehensive gathering of Baldwin's nonfiction works that articulates issues of race, democracy, and American identity. His landmark collections, Notes of a native son and Nobody knows my name fuse the personal, literary, and the political. The classic, The fire next time, provides an analysis of America's racial divide and No name in the street and The Devil finds work chart is continuing response to the social and political turbulence of his era. Thirty-six additional essays--nine previously uncollected--record insights into the language of Shakespeare, and poetry of Langston Hughes, the music of Earl Hines, and more. --From publisher description.",1998
Giovanni's Room,James Baldwin,"Set in the 1950s Paris of American expatriates, liaisons, and violence, a young man finds himself caught between desire and conventional morality. With a sharp, probing imagination, James Baldwin's now-classic narrative delves into the mystery of loving and creates a moving, highly controversial story of death and passion that reveals the unspoken complexities of the human heart.",2013-09-17
Tell Me How Long the Train's Been Gone,James Baldwin,"In this tender, impassioned fourth novel, James Baldwin created one of his most striking characters: a man struggling to become himself. 'Everyone wishes to be loved, but in the event, nearly no one can bear it' At the height of his theatrical career, the actor Leo Proudhammer is nearly felled by a heart attack. As he hovers between life and death, we see the choices that have made him enviably famous and terrifyingly vulnerable. For between Leo's childhood on the streets of Harlem and his arrival into the world of the theatre lies a wilderness of desire and loss, shame and rage. And everywhere there is the anguish of being black in a society that seems poised on the brink of racial war. In this tender, angry 1968 novel, James Baldwin created one of his most striking characters: a man struggling to become himself. 'The emotion surrounding family attachment... is deeply felt and is one reasons he continues to be read with such intensity' Colm Tóibín",2018-10-04
The Price of the Ticket,James Baldwin,"The works of James Baldwin constitute one of the major contributions to American literature in the twentieth century, and nowhere is this more evident than in The Price of the Ticket, a compendium of nearly fifty years of Baldwin's powerful nonfiction writing. With truth and insight, these personal, prophetic works speak to the heart of the experience of race and identity in the United States. Here are the full texts of Notes of a Native Son, Nobody Knows My Name, The Fire Next Time, No Name in the Street, and The Devil Finds Work, along with dozens of other pieces, ranging from a 1948 review of Raintree Country to a magnificent introduction to this book that, as so many of Mr. Baldwin's works do, combines his intensely private experience with the deepest examination of social interaction between the races. In a way, The Price of the Ticket is an intellectual history of the twentieth-century American experience; in another, it is autobiography of the highest order.",1985-09-15
Black Women in the Fiction of James Baldwin,Trudier Harris,NA,1987
Baldwin's Harlem,Herb Boyd,"Baldwin's Harlem is an intimate portrait of the life and genius of one of our most brilliant literary minds: James Baldwin. Perhaps no other writer is as synonymous with Harlem as James Baldwin (1924-1987). The events there that shaped his youth greatly influenced Baldwin's work, much of which focused on his experiences as a black man in white America. Go Tell It on the Mountain, The Fire Next Time, Notes of a Native Son, and Giovanni's Room are just a few of his classic fiction and nonfiction books that remain an essential part of the American canon. In Baldwin's Harlem, award-winning journalist Herb Boyd combines impeccable biographical research with astute literary criticism, and reveals to readers Baldwin's association with Harlem on both metaphorical and realistic levels. For example, Boyd describes Baldwin's relationship with Harlem Renaissance poet laureate Countee Cullen, who taught Baldwin French in the ninth grade. Packed with telling anecdotes, Baldwin's Harlem illuminates the writer's diverse views and impressions of the community that would remain a consistent presence in virtually all of his writing. Baldwin's Harlem provides an intelligent and enlightening look at one of America's most important literary enclaves.",2008-01-08
James Baldwin,Deborah Cannarella,"Introduction to the life and accomplishments of famed African-American writer and essayist, James Baldwin.",2003-08
A Study Guide to James Baldwin 's Sonny's Blues,"Gale, Cengage Learning","A Study Guide to James Baldwin 's Sonny's Blues, excerpted from Gale's acclaimed Short Stories for Students series. This concise study guide includes plot summary; character analysis; author biography; study questions; historical context; suggestions for further reading; and much more. For any literature project, trust Short Stories for Students for all of your research needs.",2015-09-15
James Baldwin,Deborah Cannarella,"Introduction to the life and accomplishments of famed African-American writer and essayist, James Baldwin.",2003-08
A Study Guide to James Baldwin 's Sonny's Blues,"Gale, Cengage Learning","A Study Guide to James Baldwin 's Sonny's Blues, excerpted from Gale's acclaimed Short Stories for Students series. This concise study guide includes plot summary; character analysis; author biography; study questions; historical context; suggestions for further reading; and much more. For any literature project, trust Short Stories for Students for all of your research needs.",2015-09-15
A Tribute to James Baldwin,"James Baldwin,Jules Chametzky,University of Massachusetts at Amherst. Institute for Advanced Study in the Humanities",NA,1989
The Horse Fair,James Baldwin,"Chiron, formerly of ancient Greece and now in the court of Morgan the Fay, tells Phillip about the history of the horse.",1904
The Fire Is upon Us,Nicholas Buccola,"How the clash between the civil rights firebrand and the father of modern conservatism continues to illuminate America's racial divide On February 18, 1965, an overflowing crowd packed the Cambridge Union in Cambridge, England, to witness a historic televised debate between James Baldwin, the leading literary voice of the civil rights movement, and William F. Buckley Jr., a fierce critic of the movement and America's most influential conservative intellectual. The topic was ""the American dream is at the expense of the American Negro,"" and no one who has seen the debate can soon forget it. Nicholas Buccola's The Fire Is upon Us is the first book to tell the full story of the event, the radically different paths that led Baldwin and Buckley to it, the controversies that followed, and how the debate and the decades-long clash between the men continues to illuminate America's racial divide today. Born in New York City only fifteen months apart, the Harlem-raised Baldwin and the privileged Buckley could not have been more different, but they both rose to the height of American intellectual life during the civil rights movement. By the time they met in Cambridge, Buckley was determined to sound the alarm about a man he considered an ""eloquent menace."" For his part, Baldwin viewed Buckley as a deluded reactionary whose popularity revealed the sickness of the American soul. The stage was set for an epic confrontation that pitted Baldwin's call for a moral revolution in race relations against Buckley's unabashed elitism and implicit commitment to white supremacy. A remarkable story of race and the American dream, The Fire Is upon Us reveals the deep roots and lasting legacy of a conflict that continues to haunt our politics.",2019-10-01
The Fire Next Time,James Baldwin,"The landmark work on race in America from James Baldwin, whose life and words are immortalized in the Oscar-nominated film I Am Not Your Negro 'We, the black and the white, deeply need each other here if we are really to become a nation' James Baldwin's impassioned plea to 'end the racial nightmare' in America was a bestseller when it appeared in 1963, galvanising a nation and giving voice to the emerging civil rights movement. Told in the form of two intensely personal 'letters', The Fire Next Time is at once a powerful evocation of Baldwin's early life in Harlem and an excoriating condemnation of the terrible legacy of racial injustice. 'Sermon, ultimatum, confession, deposition, testament, and chronicle ... all presented in searing, brilliant prose' The New York Times Book Review 'Baldwin writes with great passion ... it reeks of truth, as the ghettoes of New York and London, Chicago and Manchester reek of our hypocrisy' Sunday Times 'The great poet-prophet of the civil rights movement ... his seminal work' Guardian",1990-01-25
The Critical Reception of James Baldwin in France,Rosa Bobia,"""James Baldwin's reputation has to a large extent been studied as an isolated American phenomenon. This book-length study is the first that examines the large body of criticism by French-language critics. The wealth of documents makes possible the comparison of African critics of French expression of African-American literature and allows for comparisons of Francophone and American critics as well. James Baldwin is the most intensely studied author in France among the postwar group of African-American authors since Richard Wright. This study shows that the complex and substantive reasons for Baldwin's success go beyond the obvious interest of the French in African-American literature and his intermittent stay in France for nearly four decades.""--BOOK JACKET.Title Summary field provided by Blackwell North America, Inc. All Rights Reserved",1997
Fifty Famous People,James Baldwin,"Fifty Famous People. A Book of Short Stories. By James Baldwin. One of the best things to be said of the stories in this volume is that, although they are not biographical, they are about real persons who actually lived and performed their parts in the great drama of the world's history. Some of these persons were more famous than others, yet all have left enduring ""footprints on the sands of time"" and their names will not cease to be remembered. In each of the stories there is a basis of truth and an ethical lesson which cannot fail to have a wholesome influence; and each possesses elements of interest which, it is believed, will go far towards proving the fallibility of the doctrine that children find delight only in tales of the imaginative and unreal. The fact that there are a few more than fifty famous people mentioned in the volume may be credited to the author's wish to give good measure.",2014-10-19
100 Greatest African Americans,Molefi Kete Asante,"Since 1619, when Africans first came ashore in the swampy Chesapeake region of Virginia, there have been many individuals whose achievements or strength of character in the face of monumental hardships have called attention to the genius of the African American people. This book attempts to distill from many wonderful possibilities the 100 most outstanding examples of greatness. Pioneering scholar of African American Studies Molefi Kete Asante has used four criteria in his selection: the individual's significance in the general progress of African Americans toward full equality in the American social and political system; self-sacrifice and the demonstration of risk for the collective good; unusual will and determination in the face of the greatest danger or against the most stubborn odds; and personal achievement that reveals the best qualities of the African American people. In adopting these criteria Professor Asante has sought to steer away from the usual standards of popular culture, which often elevates the most popular, the wealthiest, or the most photogenic to the cult of celebrity. The individuals in this book - examples of lasting greatness as opposed to the ephemeral glare of celebrity fame - come from four centuries of African American history.Each entry includes brief biographical information, relevant dates, an assessment of the individual's place in African American history with particular reference to a historical timeline, and a discussion of his or her unique impact on American society. Numerous pictures and illustrations will accompany the articles. This superb reference work will complement any library and be of special interest to students and scholars of American and African American history.",2002
The Wonder-book of Horses,James Baldwin,NA,1903
James Baldwin,Stanley Macebuh,"Analyzes Baldwin's thought and literary works, evaluating his contributions to Black literature",1973
The Story of Abraham Lincoln for Young Readers,James Baldwin,NA,1896
Fourth Reader,"James Baldwin,Ida C. Bender",NA,1911
Hero Tales,James Baldwin,Reproduction of the original: Hero Tales by James Baldwin,2019-09-25
Across Islands and Oceans,James Baldwin,"Across Islands and Oceans is the memoir of twenty-five year-old James Baldwin and his epic two-year, solo circumnavigation in Atom, his trusty but aging twenty-eight foot sailboat. Early on and ""as broke as [he] dared to be,"" James determined not only to sail around the world, but also to hike across every island that he visits. His inland forays are unique in the literature of circumnavigators as he finds danger, humor, friendship and romance in places most sailors will never visit. James' story unfolds in his earnest exploration of distant lands and seas, his meditations on the people whose lives he touched, and his greater voyage to explore his own private ocean of solitude. His adventure is not merely an attempt to seek thrills, nor even to tempt death, but rather a voyage of discovery as he set out in the direction of his youthful dreams to meet the life he imagined. ""Go seek what you will, where you will, but be a seeker all of your life."" -James Baldwin",2012-01-31
School Reading by Grades,James Baldwin,NA,1897
The story of Siegfried,James Baldwin,NA,1883
James Baldwin,Jules B. Farber,NA,2016-07-01
Tell Me How Long the Train's Been Gone,James Baldwin,"At the height of his theatrical career, the actor Leo Proudhammer is nearly felled by a heart attack. As he hovers between life and death, Baldwin shows the choices that have made him enviably famous and terrifyingly vulnerable. For between Leo's childhood on the streets of Harlem and his arrival into the intoxicating world of the theater lies a wilderness of desire and loss, shame and rage. An adored older brother vanishes into prison. There are love affairs with a white woman and a younger black man, each of whom will make irresistible claims on Leo's loyalty. And everywhere there is the anguish of being black in a society that at times seems poised on the brink of total racial war. Overpowering in its vitality, extravagant in the intensity of its feeling, Tell Me How Long the Train's Been Gone is a major work of American literature.",2013-09-17
Thirty More Famous Stories Retold,James Baldwin,"A collection of well-known stories involving such figures as Columbus, Romulus and Remus, Penelope, Hannibal, King John, Sir Isaac Newton, etc.",1905
All Those Strangers,Douglas Field,"Adored by many, appalling to some, baffling still to others, few authors defy any single critical narrative to the confounding extent that James Baldwin manages. Was he a black or queer writer? Was he a religious or secular writer? Was he a spokesman for the civil rights movement or a champion of the individual? His critics, as disparate as his readership, endlessly wrestle with paradoxes, not just in his work but also in the life of a man who described himself as ""all those strangers called Jimmy Baldwin"" and who declared that ""all theories are suspect."" Viewing Baldwin through a cultural-historical lens alongside a more traditional literary critical approach, All Those Strangers examines how his fiction and nonfiction shaped and responded to key political and cultural developments in the United States from the 1940s to the 1980s. Showing how external forces molded Baldwin's personal, political, and psychological development, Douglas Field breaks through the established critical difficulties caused by Baldwin's geographical, ideological, and artistic multiplicity by analyzing his life and work against the radically transformative politics of his time. The book explores under-researched areas in Baldwin's life and work, including his relationship to the Left, his FBI files, and the significance of Africa in his writing, while also contributing to wider discussions about postwar US culture. Field deftly navigates key twentieth-century themes-the Cold War, African American literary history, conflicts between spirituality and organized religion, and transnationalism-to bring a number of isolated subjects into dialogue with each other. By exploring the paradoxes in Baldwin's development as a writer, rather than trying to fix his life and work into a single framework, All Those Strangers contradicts the accepted critical paradigm that Baldwin's life and work are too ambiguous to make sense of. By studying him as an individual and an artist in flux, Field reveals the manifold ways in which Baldwin's work develops and coheres.",2015
Thirty More Famous Stories Retold,James Baldwin,"A collection of well-known stories involving such figures as Columbus, Romulus and Remus, Penelope, Hannibal, King John, Sir Isaac Newton, etc.",1905
