title,authors,description,published_date
Digital_Humanities,"Anne Burdick,Johanna Drucker,Peter Lunenfeld,Todd Presner,Jeffrey Schnapp","Digital_Humanities is a compact, game-changing report on the state of contemporary knowledge production. Answering the question ""What is digital humanities?,"" it provides an in-depth examination of an emerging field. This collaboratively authored and visually compelling volume explores methodologies and techniques unfamiliar to traditional modes of humanistic inquiry -- including geospatial analysis, data mining, corpus linguistics, visualization, and simulation -- to show their relevance for contemporary culture. Written by five leading practitioner-theorists whose varied backgrounds embody the intellectual and creative diversity of the field, Digital_Humanities is a vision statement for the future, an invitation to engage, and a critical tool for understanding the shape of new scholarship.",2012-11-16
Debates in the Digital Humanities 2016,"Matthew K. Gold,Lauren F. Klein","Pairing full-length scholarly essays with shorter pieces drawn from scholarly blogs and conference presentations, as well as commissioned interviews and position statements, Debates in the Digital Humanities 2016 reveals a dynamic view of a field in negotiation with its identity, methods, and reach. Pieces in the book explore how DH can and must change in response to social justice movements and events like #Ferguson; how DH alters and is altered by community college classrooms; and how scholars applying DH approaches to feminist studies, queer studies, and black studies might reframe the commitments of DH analysts. Numerous contributors examine the movement of interdisciplinary DH work into areas such as history, art history, and archaeology, and a special forum on large-scale text mining brings together position statements on a fast-growing area of DH research. In the multivalent aspects of its arguments, progressing across a range of platforms and environments, Debates in the Digital Humanities 2016 offers a vision of DH as an expanded field—new possibilities, differently structured. Published simultaneously in print, e-book, and interactive webtext formats, each DH annual will be a book-length publication highlighting the particular debates that have shaped the discipline in a given year. By identifying key issues as they unfold, and by providing a hybrid model of open-access publication, these volumes and the Debates in the Digital Humanities series will articulate the present contours of the field and help forge its future. Contributors: Moya Bailey, Northeastern U; Fiona Barnett; Matthew Battles, Harvard U; Jeffrey M. Binder; Zach Blas, U of London; Cameron Blevins, Rutgers U; Sheila A. Brennan, George Mason U; Timothy Burke, Swarthmore College; Rachel Sagner Buurma, Swarthmore College; Micha Cárdenas, U of Washington–Bothell; Wendy Hui Kyong Chun, Brown U; Tanya E. Clement, U of Texas–Austin; Anne Cong-Huyen, Whittier College; Ryan Cordell, Northeastern U; Tressie McMillan Cottom, Virginia Commonwealth U; Amy E. Earhart, Texas A&M U; Domenico Fiormonte, U of Roma Tre; Paul Fyfe, North Carolina State U; Jacob Gaboury, Stony Brook U; Kim Gallon, Purdue U; Alex Gil, Columbia U; Brian Greenspan, Carleton U; Richard Grusin, U of Wisconsin, Milwaukee; Michael Hancher, U of Minnesota; Molly O’Hagan Hardy; David L. Hoover, New York U; Wendy F. Hsu; Patrick Jagoda, U of Chicago; Jessica Marie Johnson, Michigan State U; Steven E. Jones, Loyola U; Margaret Linley, Simon Fraser U; Alan Liu, U of California, Santa Barbara; Elizabeth Losh, U of California, San Diego; Alexis Lothian, U of Maryland; Michael Maizels, Wellesley College; Mark C. Marino, U of Southern California; Anne B. McGrail, Lane Community College; Bethany Nowviskie, U of Virginia; Julianne Nyhan, U College London; Amanda Phillips, U of California, Davis; Miriam Posner, U of California, Los Angeles; Rita Raley, U of California, Santa Barbara; Stephen Ramsay, U of Nebraska–Lincoln; Margaret Rhee, U of Oregon; Lisa Marie Rhody, Graduate Center, CUNY; Roopika Risam, Salem State U; Stephen Robertson, George Mason U; Mark Sample, Davidson College; Jentery Sayers, U of Victoria; Benjamin M. Schmidt, Northeastern U; Scott Selisker, U of Arizona; Jonathan Senchyne, U of Wisconsin, Madison; Andrew Stauffer, U of Virginia; Joanna Swafford, SUNY New Paltz; Toniesha L. Taylor, Prairie View A&M U; Dennis Tenen; Melissa Terras, U College London; Anna Tione; Ted Underwood, U of Illinois, Urbana–Champaign; Ethan Watrall, Michigan State U; Jacqueline Wernimont, Arizona State U; Laura Wexler, Yale U; Hong-An Wu, U of Illinois, Urbana–Champaign.",2016-05-18
The Digital Humanities,"Eileen Gardiner,Ronald G. Musto","This is an introduction and practical guide to how humanists use the digital to research, organize, analyze, and publish findings.",2015-06-30
Understanding Digital Humanities,D. Berry,"Confronting the digital revolution in academia, this book examines the application of new computational techniques and visualisation technologies in the Arts & Humanities. Uniting differing perspectives, leading and emerging scholars discuss the theoretical and practical challenges that computation raises for these disciplines.",2012-02-07
Digital Humanities,"David M. Berry,Anders Fagerjord","As the twenty-first century unfolds, computers challenge the way in which we think about culture, society and what it is to be human: areas traditionally explored by the humanities. In a world of automation, Big Data, algorithms, Google searches, digital archives, real-time streams and social networks, our use of culture has been changing dramatically. The digital humanities give us powerful theories, methods and tools for exploring new ways of being in a digital age. Berry and Fagerjord provide a compelling guide, exploring the history, intellectual work, key arguments and ideas of this emerging discipline. They also offer an important critique, suggesting ways in which the humanities can be enriched through computing, but also how cultural critique can transform the digital humanities. Digital Humanities will be an essential book for students and researchers in this new field but also related areas, such as media and communications, digital media, sociology, informatics, and the humanities more broadly.",2017-05-30
A Companion to Digital Humanities,"Susan Schreibman,Ray Siemens,John Unsworth","This Companion offers a thorough, concise overview of the emerging field of humanities computing. Contains 37 original articles written by leaders in the field. Addresses the central concerns shared by those interested in the subject. Major sections focus on the experience of particular disciplines in applying computational methods to research problems; the basic principles of humanities computing; specific applications and methods; and production, dissemination and archiving. Accompanied by a website featuring supplementary materials, standard readings in the field and essays to be included in future editions of the Companion.",2008-04-15
Research Methods for the Digital Humanities,"lewis levenberg,Tai Neilson,David Rheams","This volume introduces the reader to the wide range of methods that digital humanities employ, and offers a practical guide to the study, interpretation, and presentation of cultural material and practices. In this instance, the editors consider digital humanities to include both the use of computing to understand cultural material in new ways, and the application of theories and methods from the humanities to interpret new technologies. Each chapter provides a step-by-step guide to cutting-edge methodologies so that students can make informed decisions about the methods they use, consider ethical practices, follow practical procedures, and present their work effectively. Readers will develop practical and reflexive understandings of the software and digital devices that they study and use for research, and the book will help new researchers collaborate and contribute to their scholarly communities, and to public discourse. As contemporary humanities work becomes increasingly interdisciplinary, and increasingly permeated by and with digital technologies, this volume helps new researchers navigate an evolving academic environment. Humanities and social sciences students will find this textbook an invaluable resource for assessing and creating digital projects.",2018
Digital Humanities and Buddhism,Daniel Veidlinger,"IDH Religion provides a series of short introductions to specific areas of study at the intersections of digital humanities and religion, offering an overview of current methodologies, techniques, tools, and projects as well as defining challenges and opportunities for further research. This volume explores DH and Buddhism in four sections: Theory and Method; Digital Conservation, Preservation and Archiving; Digital Analysis; Digital Resources. It covers themes such as language processing, digital libraries, online lexicography, and ethnographic methods.",2019-06-04
Doing Digital Humanities,"Constance Crompton,Richard J Lane,Ray Siemens","Digital Humanities is rapidly evolving as a significant approach to/method of teaching, learning and research across the humanities. This is a first-stop book for people interested in getting to grips with digital humanities whether as a student or a professor. The book offers a practical guide to the area as well as offering reflection on the main objectives and processes, including: Accessible introductions of the basics of Digital Humanities through to more complex ideas A wide range of topics from feminist Digital Humanities, digital journal publishing, gaming, text encoding, project management and pedagogy Contextualised case studies Resources for starting Digital Humanities such as links, training materials and exercises Doing Digital Humanities looks at the practicalities of how digital research and creation can enhance both learning and research and offers an approachable way into this complex, yet essential topic.",2016-09-13
The Emergence of the Digital Humanities,Steven E. Jones,"The past decade has seen a profound shift in our collective understanding of the digital network. What was once understood to be a transcendent virtual reality is now experienced as a ubiquitous grid of data that we move through and interact with every day, raising new questions about the social, locative, embodied, and object-oriented nature of our experience in the networked world. In The Emergence of the Digital Humanities, Steven E. Jones examines this shift in our relationship to digital technology and the ways that it has affected humanities scholarship and the academy more broadly. Based on the premise that the network is now everywhere rather than merely ""out there,"" Jones links together seemingly disparate cultural events—the essential features of popular social media, the rise of motion-control gaming and mobile platforms, the controversy over the ""gamification"" of everyday life, the spatial turn, fabrication and 3D printing, and electronic publishing—and argues that cultural responses to changes in technology provide an essential context for understanding the emergence of the digital humanities as a new field of study in this millennium.",2013-08-15
Digital Humanities in Practice,"Claire Warwick,Melissa Terras,Julianne Nyhan","This cutting-edge and comprehensive introduction to digital humanities explains the scope of the discipline and state of the art and provides a wide-ranging insight into emerging topics and avenues of research. Each chapter interweaves the expert commentary of leading academics with analysis of current research and practice, exploring the possibilities and challenges that occur when culture and digital technologies intersect. International case studies of projects ranging from crowdsourced manuscript transcription to computational reconstruction of frescoes are included in each chapter, providing a wealth of information and inspiration. QR codes within each chapter link to a dedicated website where additional content, such as further case studies, is located. Key topics covered include: • studying users and readers • social media and crowdsourcing • digitization and digital resources • image processing in the digital humanities • 3D recording and museums • electronic text and text encoding • book history, texts and digital editing • open access and online teaching of digital humanities • institutional models for digital humanities. Readership: This is an essential practical guide for academics, researchers, librarians and professionals involved in the digital humanities. It will also be core reading for all humanities students and those taking courses in the digital humanities in particular.",2012-10-09
Defining Digital Humanities,"Melissa Terras,Julianne Nyhan,Edward Vanhoutte","Digital Humanities is becoming an increasingly popular focus of academic endeavour. There are now hundreds of Digital Humanities centres worldwide and the subject is taught at both postgraduate and undergraduate level. Yet the term ’Digital Humanities’ is much debated. This reader brings together, for the first time, in one core volume the essential readings that have emerged in Digital Humanities. We provide a historical overview of how the term ’Humanities Computing’ developed into the term ’Digital Humanities’, and highlight core readings which explore the meaning, scope, and implementation of the field. To contextualize and frame each included reading, the editors and authors provide a commentary on the original piece. There is also an annotated bibliography of other material not included in the text to provide an essential list of reading in the discipline. This text will be required reading for scholars and students who want to discover the history of Digital Humanities through its core writings, and for those who wish to understand the many possibilities that exist when trying to define Digital Humanities.",2016-05-13
Collaborative Research in the Digital Humanities,"Willard Mccarty,Marilyn Deegan","Collaboration within digital humanities is both a pertinent and a pressing topic as the traditional mode of the humanist, working alone in his or her study, is supplemented by explicitly co-operative, interdependent and collaborative research. This is particularly true where computational methods are employed in large-scale digital humanities projects. This book, which celebrates the contributions of Harold Short to this field, presents fourteen essays by leading authors in the digital humanities. It addresses several issues of collaboration, from the multiple perspectives of institutions, projects and individual researchers.",2016-05-23
Formal Representation and the Digital Humanities,"Paola Cotticelli-Kurras,Federico Giusfredi","What do linguistics, philology and even cultural studies have in common? There can be many answers for this question; certainly, however, they all have to deal with the new technologies and methods that go by the name of “Digital Humanities”. Today, all human sciences are facing new challenges both from the methodological point of view and from their very scientific contents. Accordingly, the number of research fields and approaches represented in this volume is large, reflecting the complexity of the problems of formalization, computation and digitalization of data and resources. The future of human sciences will be marked by the ever-increasing importance of formal models and computational tools, and the effective communication among the specialists of different fields is crucial for the scientific success of every single area of research. This collection of cutting-edge, high-quality papers is a fundamental step towards a better definition of the role the “Digital Humanities” will play in the next years.",2018-12-14
Rhetoric and the Digital Humanities,"Jim Ridolfo,William Hart-Davidson","Within the digital humanities, rhetoric has emerged as a nexus of incredible innovation, and ""Rhetoric and the Digital Humanities"" provides extensive and much-needed guidance on how the theories and methodologies of rhetorical studies can be marshaled in highly successful ways to enhance all work in digital humanities. In addition to an insightful introduction from the editors, the book offers essays from leading scholars in a variety of disciplines, organized into three tightly focused sections. The first consists of seven chapters that define field connections between rhetoric and the digital humanities. The second section offers six chapters focused on research methodology. And the third presents ten chapters offering forward-looking recommendations on pathways for exploring interdisciplinary trajectories between rhetorical studies and the digital humanities. This timely edited collection will do much to promote and strengthen interdisciplinary collaborations in the digital humanities.",2015-01-19
Big Digital Humanities,Patrik Svensson,"Big Digital Humanities has its origins in a series of seminal articles Patrik Svensson published in the Digital Humanities Quarterly between 2009 and 2012. As these articles were coming out, enthusiasm around Digital Humanities was acquiring a great deal of momentum and significant disagreement about what did or didn’t “count” as Digital Humanities work. Svensson’s articles provided a widely sought after omnibus of Digital Humanities history, practice, and theory. They were informative and knowledgeable and tended to foreground reportage and explanation rather than utopianism or territorial contentiousness. In revising his original work for book publication, Svensson has responded to both subsequent feedback and new developments. Svensson’s own unique perspective and special stake in the Digital Humanities conversation comes from his role as director of the HUMlab at Umeå University. HUMlab is a unique collaborative space and Digital Humanities center, which officially opened its doors in 2000. According to its own official description, the HUMlab is an open, creative studio environment where “students, researchers, artists, entrepreneurs and international guests come together to engage in dialogue, experiment with technology, take on challenges and move scholarship forward.” It is this last element “moving scholarship forward” that Svensson argues is the real opportunity in what he terms the “big digital humanities,” or digital humanities as practiced in collaborative spaces like the HUMlab, and he is uniquely positioned to take an account of this evolving dimension of Digital Humanities practice.",2016-07-22
Digital Humanities,Bernard Wilcox,"The field of study concerned with the interaction of humanities and digital technologies is referred to as digital humanities. The systematic use of humanities related digital resources and their applications are included in this field. It uses computing tools like text mining, data mining, data visualization, hypertext, digital mapping, statistics, information retrieval and hypermedia, among many others. Fields related to digital humanities are software studies, critical code studies and platform studies. The diverse methods in this discipline include enhanced critical curation, cultural analytics, aggregation, the animated archive, database documentaries, augmented editions, etc. This book attempts to understand the multiple branches that fall under the discipline of digital humanities and how such concepts have practical applications. It strives to provide a fair idea about this discipline and to help develop a better understanding of the latest advances within this field. The topics covered in this book offer the readers new insights in the field of digital humanities.",2019-06-18
Digital Humanities,Bryan Carter,"Digital Humanities is becoming more exciting as mobile and desktop apps flood the market allowing users to accomplish tasks that not long ago were either impossible or required complicated coding or high-end computing. This volume considers the tools that provide access to digital communications, visualization, storage and retrieval at unprecedente",2013-11-19
Digital Curation in the Digital Humanities,Arjun Sabharwal,"Archives and special collections departments have a long history of preserving and providing long-term access to organizational records, rare books, and other unique primary sources including manuscripts, photographs, recordings, and artifacts in various formats. The careful curatorial attention to such records has also ensured that such records remain available to researchers and the public as sources of knowledge, memory, and identity. Digital curation presents an important framework for the continued preservation of digitized and born-digital collections, given the ephemeral and device-dependent nature of digital content. With the emergence of analog and digital media formats in close succession (compared to earlier paper- and film-based formats) came new standards, technologies, methods, documentation, and workflows to ensure safe storage and access to content and associated metadata. Researchers in the digital humanities have extensively applied computing to research; for them, continued access to primary data and cultural heritage means both the continuation of humanities scholarship and new methodologies not possible without digital technology. Digital Curation in the Digital Humanities, therefore, comprises a joint framework for preserving, promoting, and accessing digital collections. This book explores at great length the conceptualization of digital curation projects with interdisciplinary approaches that combine the digital humanities and history, information architecture, social networking, and other themes for such a framework. The individual chapters focus on the specifics of each area, but the relationships holding the knowledge architecture and the digital curation lifecycle model together remain an overarching theme throughout the book; thus, each chapter connects to others on a conceptual, theoretical, or practical level. theoretical and practical perspectives on digital curation in the digital humanities and history in-depth study of the role of social media and a social curation ecosystem the role of hypertextuality and information architecture in digital curation study of collaboration and organizational dimensions in digital curation reviews of important web tools in digital humanities",2015-04-11
Guide to Programming for the Digital Humanities,Brian Kokensparger,"As an introduction to programming for the Digital Humanities (DH), this book presents six key assignments oriented on DH topics. The topics include Computing Change Over Time (calculating burials at a historic cemetery), Visualizing Change Over Time (visualizing the burials at the historic cemetery), Textual Analysis (finding word frequencies and “stop words” in public domain texts), XML Transformation (transforming a simplified version of XML into HTML styled with CSS), Stylometry (comparing the measured features of graphic images), and Social Network Analysis (analyzing extended relationships in historic circles). The book focuses on the practical application of these assignments in the classroom, providing a range of variations for each assignment, which can be selected on the basis of students’ specific programming background and skills; “atomic” assignments, which can be used to give students the experience they need to successfully complete the main assignments; and some common pitfalls and gotchas to manage in the classroom. The book’s chief goals are to introduce novice computer science (CS) students to programming for DH, and to offer them valuable hands-on experience with core programming concepts.",2018-08-23
Digital Humanities,Olivier Le Deuff,"Where do the digital humanities really come from? Are they really news? What are the theoretical and technical influences that participate in this scientific field that arouses interest and questions? This book tries to show and explain the main theories and methods that have allowed their current constitution. The aim of the book is to propose a new way to understand the history of digital humanities in a broader perspective than the classic history with the project of Robert Busa. The short digital humanities perspective neglects lots of actors and disciplines. The book tries to show the importance of other fields than humanities computing like scientometry, infometry, econometry, mathematical linguistics, geography and documentation.",2018-04-16
Rhetoric and the Digital Humanities,"Jim Ridolfo,William Hart-Davidson","Within the digital humanities, rhetoric has emerged as a nexus of incredible innovation, and ""Rhetoric and the Digital Humanities"" provides extensive and much-needed guidance on how the theories and methodologies of rhetorical studies can be marshaled in highly successful ways to enhance all work in digital humanities. In addition to an insightful introduction from the editors, the book offers essays from leading scholars in a variety of disciplines, organized into three tightly focused sections. The first consists of seven chapters that define field connections between rhetoric and the digital humanities. The second section offers six chapters focused on research methodology. And the third presents ten chapters offering forward-looking recommendations on pathways for exploring interdisciplinary trajectories between rhetorical studies and the digital humanities. This timely edited collection will do much to promote and strengthen interdisciplinary collaborations in the digital humanities.",2015-01-19
