title,authors,description,published_date
Defining Digital Humanities,"Melissa Terras,Julianne Nyhan,Edward Vanhoutte","Digital Humanities is becoming an increasingly popular focus of academic endeavour. There are now hundreds of Digital Humanities centres worldwide and the subject is taught at both postgraduate and undergraduate level. Yet the term ’Digital Humanities’ is much debated. This reader brings together, for the first time, in one core volume the essential readings that have emerged in Digital Humanities. We provide a historical overview of how the term ’Humanities Computing’ developed into the term ’Digital Humanities’, and highlight core readings which explore the meaning, scope, and implementation of the field. To contextualize and frame each included reading, the editors and authors provide a commentary on the original piece. There is also an annotated bibliography of other material not included in the text to provide an essential list of reading in the discipline. This text will be required reading for scholars and students who want to discover the history of Digital Humanities through its core writings, and for those who wish to understand the many possibilities that exist when trying to define Digital Humanities.",2016-05-13
Cultural Heritage Infrastructures in Digital Humanities,"Agiatis Benardou,Erik Champion,Costis Dallas,Lorna Hughes","What are the leading tools and archives in digital cultural heritage? How can they be integrated into research infrastructures to better serve their intended audiences? In this book, authors from a wide range of countries, representing some of the best research projects in digital humanities related to cultural heritage, discuss their latest findings, both in terms of new tools and archives, and how they are used (or not used) by both specialists and by the general public.",2017-09-22
Digital Humanities,SALLY. CHAMBERS,"Librarians have an important role to play in the burgeoning world of Digital Humanities and digital scholarship more widely. This book provides an accessible, introductory guide to digital humanities with the librarian in mind. Digital Humanities: An introduction for librarians gives a brief history of the field, before dives deeper into the digital scholarly activity taking a two-pronged approach, involving active researchers in the field and using real research projects as case studies throughout. The book will: provide an overview of how 'the digital' has affected a range of humanities disciplines from literary studies, history to digital musicology Review key tools and methodologies currently used, from digital scholarly editing through social network analysis to 3D modelling of archaeological data look at existing digital humanities activities that are currently happening in a range of libraries across the UK, Europe and the United States look at professional development and training opportunities from digital humanities at library school, staff training and development, including examples of training programmes and professional associations. This book is intended to provide an essential guide to getting up to speed with digital humanities, specifically designed with the librarian in mind.",2020-04-30
Critical Digital Humanities,James E Dobson,"Can established humanities methods coexist with computational thinking? It is one of the major questions in humanities research today, as scholars increasingly adopt sophisticated data science for their work. James E. Dobson explores the opportunities and complications faced by humanists in this new era. Though the study and interpretation of texts alongside sophisticated computational tools can serve scholarship, these methods cannot replace existing frameworks. As Dobson shows, ideas of scientific validity cannot easily nor should be adapted for humanities research because digital humanities, unlike science, lack a leading-edge horizon charting the frontiers of inquiry. Instead, the methods of digital humanities require a constant rereading. At the same time, suspicious and critical readings of digital methodologies make it unwise for scholars to defer to computational methods. Humanists must examine the tools--including the assumptions that went into the codes and algorithms--and questions surrounding their own use of digital technology in research. Insightful and forward thinking, Critical Digital Humanities lays out a new path of humanistic inquiry that merges critical theory and computational science.",2019-03-16
Digital Humanities Pedagogy,Brett D. Hirsch,"""The essays in this collection offer a timely intervention in digital humanities scholarship, bringing together established and emerging scholars from a variety of humanities disciplines across the world. The first section offers views on the practical realities of teaching digital humanities at undergraduate and graduate levels, presenting case studies and snapshots of the authors' experiences alongside models for future courses and reflections on pedagogical successes and failures. The next section proposes strategies for teaching foundational digital humanities methods across a variety of scholarly disciplines, and the book concludes with wider debates about the place of digital humanities in the academy, from the field's cultural assumptions and social obligations to its political visions."" (4e de couverture).",2012
Formal Representation and the Digital Humanities,"Paola Cotticelli-Kurras,Federico Giusfredi","What do linguistics, philology and even cultural studies have in common? There can be many answers for this question; certainly, however, they all have to deal with the new technologies and methods that go by the name of “Digital Humanities”. Today, all human sciences are facing new challenges both from the methodological point of view and from their very scientific contents. Accordingly, the number of research fields and approaches represented in this volume is large, reflecting the complexity of the problems of formalization, computation and digitalization of data and resources. The future of human sciences will be marked by the ever-increasing importance of formal models and computational tools, and the effective communication among the specialists of different fields is crucial for the scientific success of every single area of research. This collection of cutting-edge, high-quality papers is a fundamental step towards a better definition of the role the “Digital Humanities” will play in the next years.",2018-12-14
Teaching with Digital Humanities,"Jennifer Travis,Jessica DeSpain","Jennifer Travis and Jessica DeSpain present a long-overdue collection of theoretical perspectives and case studies aimed at teaching nineteenth-century American literature using digital humanities tools and methods. Scholars foundational to the development of digital humanities join educators who have made digital methods central to their practices. Together they discuss and illustrate how digital pedagogies deepen student learning. The collection's innovative approach allows the works to be read in any order. Dividing the essays into five sections, Travis and DeSpain curate conversations on the value of project-based, collaborative learning; examples of real-world assignments where students combine close, collaborative, and computational reading; how digital humanities aids in the consideration of marginal texts; the ways in which an ethics of care can help students organize artifacts; and how an activist approach affects debates central to the study of difference in the nineteenth century.",2018-11-15
Debates in the Digital Humanities 2019,"Matthew K. Gold,Lauren F. Klein","The latest installment of a digital humanities bellwether Contending with recent developments like the shocking 2016 U.S. Presidential election, the radical transformation of the social web, and passionate debates about the future of data in higher education, Debates in the Digital Humanities 2019 brings together a broad array of important, thought-provoking perspectives on the field’s many sides. With a wide range of subjects including gender-based assumptions made by algorithms, the place of the digital humanities within art history, data-based methods for exhuming forgotten histories, video games, three-dimensional printing, and decolonial work, this book assembles a who’s who of the field in more than thirty impactful essays. Contributors: Rafael Alvarado, U of Virginia; Taylor Arnold, U of Richmond; James Baker, U of Sussex; Kathi Inman Berens, Portland State U; David M. Berry, U of Sussex; Claire Bishop, The Graduate Center, CUNY; James Coltrain, U of Nebraska–Lincoln; Crunk Feminist Collective; Johanna Drucker, U of California–Los Angeles; Jennifer Edmond, Trinity College; Marta Effinger-Crichlow, New York City College of Technology–CUNY; M. Beatrice Fazi, U of Sussex; Kevin L. Ferguson, Queens College–CUNY; Curtis Fletcher, U of Southern California; Neil Fraistat, U of Maryland; Radhika Gajjala, Bowling Green State U; Michael Gavin, U of South Carolina; Andrew Goldstone, Rutgers U; Andrew Gomez, U of Puget Sound; Elyse Graham, Stony Brook U; Brian Greenspan, Carleton U; John Hunter, Bucknell U; Steven J. Jackson, Cornell U; Collin Jennings, Miami U; Lauren Kersey, Saint Louis U; Kari Kraus, U of Maryland; Seth Long, U of Nebraska, Kearney; Laura Mandell, Texas A&M U; Rachel Mann, U of South Carolina; Jason Mittell, Middlebury College; Lincoln A. Mullen, George Mason U; Trevor Muñoz, U of Maryland; Safiya Umoja Noble, U of Southern California; Jack Norton, Normandale Community College; Bethany Nowviskie, U of Virginia; Élika Ortega, Northeastern U; Marisa Parham, Amherst College; Jussi Parikka, U of Southampton; Kyle Parry, U of California, Santa Cruz; Brad Pasanek, U of Virginia; Stephen Ramsay, U of Nebraska–Lincoln; Matt Ratto, U of Toronto; Katie Rawson, U of Pennsylvania; Ben Roberts, U of Sussex; David S. Roh, U of Utah; Mark Sample, Davidson College; Moacir P. de Sá Pereira, New York U; Tim Sherratt, U of Canberra; Bobby L. Smiley, Vanderbilt U; Lauren Tilton, U of Richmond; Ted Underwood, U of Illinois, Urbana-Champaign; Megan Ward, Oregon State U; Claire Warwick, Durham U; Alban Webb, U of Sussex; Adrian S. Wisnicki, U of Nebraska–Lincoln.",2019-04-30
Digital Humanities,Bryan Carter,"Digital Humanities is becoming more exciting as mobile and desktop apps flood the market allowing users to accomplish tasks that not long ago were either impossible or required complicated coding or high-end computing. This volume considers the tools that provide access to digital communications, visualization, storage and retrieval at unprecedente",2013-11-19
Digital Humanities and New Ways of Teaching,Anna Wing-bo Tso,"This volume includes a variety of first-hand case studies, critical analyses, action research and reflective practice in the digital humanities which ranges from digital literature, library science, online games, museum studies, information literacy to corpus linguistics in the 21st century. It informs readers of the latest developments in the digital humanities and their influence on learning and teaching. With the growing advancement of digital technology, humanistic inquiries have expanded and transformed in unfathomable complexity as new content is being rapidly created. The emergence of electronic archiving, digital scholarship, digitized pedagogy, textual digitization and software creation has brought about huge impacts on both humanities subjects and the university curricula in terms of nature, scope and design. This volume provides insights into what these technological changes mean for all the stakeholders involved and for the ways in which humanities subjects are understood. Part 1 of this volume begins with a broad perspective on digital humanities and discusses the current status of the field in Asia, Canada and Europe. Then, with a special focus on new literacies, educational implications, and innovative research in the digital humanities, Parts 2-4 explore how digital technology revolutionizes art forms, curricula, and pedagogy, revealing the current practices and latest trends in the digital humanities. Written by experts and researchers across Asia, Australia, Canada and Europe, this volume brings global insights into the digital humanities, particularly in the education aspect. It is of interest to researchers and students of cultural studies, literature, education, and technology studies. The strongest point of this collection of work is that, it brings important concepts to the study of digital literacies, for example, looking at it from the perspective of new literacies, languages and education. Daniel Churchill, Associate Professor, Faculty of Education, The University of Hong Kong With a rapidly growing advancement in digital tools, this book has made a relevant contribution by informing readers what the latest development of these tools are, and discusses how they can aid research, libraries, education and even poets across different continents. Samuel Kai-wah Chu, Associate Professor, Faculty of Education, The University of Hong Kong",2019-01-10
Guide to Programming for the Digital Humanities,Brian Kokensparger,"As an introduction to programming for the Digital Humanities (DH), this book presents six key assignments oriented on DH topics. The topics include Computing Change Over Time (calculating burials at a historic cemetery), Visualizing Change Over Time (visualizing the burials at the historic cemetery), Textual Analysis (finding word frequencies and “stop words” in public domain texts), XML Transformation (transforming a simplified version of XML into HTML styled with CSS), Stylometry (comparing the measured features of graphic images), and Social Network Analysis (analyzing extended relationships in historic circles). The book focuses on the practical application of these assignments in the classroom, providing a range of variations for each assignment, which can be selected on the basis of students’ specific programming background and skills; “atomic” assignments, which can be used to give students the experience they need to successfully complete the main assignments; and some common pitfalls and gotchas to manage in the classroom. The book’s chief goals are to introduce novice computer science (CS) students to programming for DH, and to offer them valuable hands-on experience with core programming concepts.",2018-08-23
The Big Humanities,Richard J. Lane,"This book provides an accessible introduction to, and overview of, the digital humanities, one of the fastest growing areas of literary studies. Lane takes a unique approach by focusing on the technologies and the new environment in which the digital humanities largely takes place: the digital laboratory. The book provides a brief history of DH, explores and explains the methodologies of past and current DH projects, and offers resources such as detailed case studies and bibliographies. Further, the focus on the digital laboratory space reveals affiliations with the types of research that have traditionally taken place in the sciences, as well as convergences with other fast-growing research spaces, namely innovation labs, fabrication labs, maker spaces, digital media labs, and change labs. The volume highlights the profound transformation of literary studies that is underway, one in which the adoption of powerful technology – and concomitantly being situated within a laboratory environment – is leading to an important re-engagement in the arts and humanities, and a renewed understanding of literary studies in the digital age, as well as a return to large-scale financial investment in humanistic research. It will be useful to students and teachers, as well as administrators and managers in charge of research infrastructure and funding decisions who need an accessible overview of this technological transformation in the humanities. Combining useful detail and an overview of the field, the book will offers accessible entry into this rapidly growing field.",2016-11-25
Research Methods for Reading Digital Data in the Digital Humanities,Gabriele Griffin,"The first volume to introduce the techniques and methods of reading digital material for researchDigital Humanities has become one of the new domains of academe at the interface of technological development, epistemological change, and methodological concerns. This volume explores how digital material might be read or utilized in research, whether that material is digitally born as fanfiction, for example, mostly is, or transposed from other sources. The volume asks questions such as what happens when text is transformed from printed into digital matter, and how that impacts on the methods we bring to bear on exploring that technologized matter, for example in the case of digital editions. Issues such as how to analyse visual material in digital archives or Twitter feeds, how to engage in data mining, what it means to undertake crowd-sourcing, big data, and what digital network analyses can tell us about online interactions are dealt with. This will give Humanities researchers ideas for doing digitally based research and also suggest ways of engaging with new digital research methods. Key featuresFirst volume centred on the navigation and interpretation of digital material as research methods in the HumanitiesUp-to-date analyses of issues and methods including big data, crowdsourcing, digital network analysis, working with digital additionsBased on actual research projects such as para-textual work with fanfiction, reading twitter, different kinds of distant and close readings",2016-02-15
NEW COMPANION TO DIGITAL HUMANITIES,SUSAN SCHREIBMAN,NA,2015-11-20
Interdisciplining Digital Humanities,Julie T Klein,The first book to test the claim that the emerging field of Digital Humanities is interdisciplinary and also examines the boundary work of establishing and sustaining a new field of study,2015-01-05
Humanities Computing,W. McCarty,"Humanities Computing provides a rationale for a computing practice that is of and for as well as in the humanities and the interpretative social sciences. It engages philosophical, historical, ethnographic and critical perspectives to show how computing helps us fulfil the basic mandate of the humane sciences to ask ever better questions of the most challenging kind. It strengthens current practice by stimulating debate on the role of the computer in our intellectual life, and outlines an agenda for the field to which individual scholars across the humanities can contribute.",2005-01-01
Research Methods for Creating and Curating Data in the Digital Humanities,Matt Hayler,"As all scholars increasingly use digital tools to support their research, and every internet user becomes used to data being available, elucidating, and engaging, the creative aspects of Digital Humanities work are coming under increasing scrutiny. This volume explores the practice of making new tools, new images, new collections, and new artworks in an academic environment, detailing who needs to be involved and what their roles might be, and how they come together to produce knowledge as a collective. The chapters presented here demonstrate that creation is never neutral with political and theoretical concerns intentionally or unavoidably always being written into the fabric of what is being made, even if that's the seeming neatness of computer code. In presenting their own creative research, the writers in this volume offer examples of practice that will be of use to anyone interested in learning more about contemporary Digital Humanities scholarship and its implications.",2016-05-30
"Composition, Creative Writing Studies, and the Digital Humanities",Adam Koehler,"In an era of blurred generic boundaries, multimedia storytelling, and open-source culture, creative writing scholars stand poised to consider the role that technology-and the creative writer's playful engagement with technology-has occupied in the evolution of its theory and practice. Composition, Creative Writing Studies and the Digital Humanities is the first book to bring these three fields together to open up new opportunities and directions for creative writing studies. Placing the rise of Creative Writing Studies alongside the rise of the digital humanities in Composition/Rhetoric, Adam Koehler shows that the use of new media and its attendant re-evaluation of fundamental assumptions in the field stands to guide Creative Writing Studies into a new era. Covering current developments in composition and the digital humanities, this book re-examines established assumptions about process, genre, authority/authorship and pedagogical practice in the creative writing classroom.",2017-01-26
NEW COMPANION TO DIGITAL HUMANITIES,SUSAN SCHREIBMAN,NA,2015-11-20
Humanities Computing,W. McCarty,"Humanities Computing provides a rationale for a computing practice that is of and for as well as in the humanities and the interpretative social sciences. It engages philosophical, historical, ethnographic and critical perspectives to show how computing helps us fulfil the basic mandate of the humane sciences to ask ever better questions of the most challenging kind. It strengthens current practice by stimulating debate on the role of the computer in our intellectual life, and outlines an agenda for the field to which individual scholars across the humanities can contribute.",2005-01-01
The Digital Humanities and the Digital Modern,James Smithies,"This book provides new critical and methodological approaches to digital humanities, intended to guide technical development as well as critical analysis. Informed by the history of technology and culture and new perspectives on modernity, Smithies grounds his claims in the engineered nature of computing devices and their complex entanglement with our communities, our scholarly traditions, and our sense of self. The distorting mentalité of the digital modern informs our attitudes to computers and computationally intensive research, leading scholars to reject articulations of meaning that admit the interdependence of humans and the complex socio-technological systems we are embedded in. By framing digital humanities with the digital modern, researchers can rebuild our relationship to technical development, and seek perspectives that unite practical and critical activity. This requires close attention to the cyber-infrastructures that inform our research, the software-intensive methods that are producing new knowledge, and the ethical issues implicit in the production of digital humanities tools and methods. The book will be of interest to anyone interested in the intersection of technology with humanities research, and the future of digital humanities.",2017-08-28
Using Digital Humanities in the Classroom,"Claire Battershill,Shawna Ross","Rooted in the day-to-day experience of teaching and written for those without specialist technical knowledge, this book is the first practical guide to using digital tools and resources in the humanities classroom. Using Digital Humanities in the Classroom covers such topics as: · Overcoming resistance to technology – your own, your colleagues' and your students' · Finding, evaluating and using digital resources · Designing syllabi and planning classroom activities and assignments · Solving problems when technology goes wrong · Using digital tools for collaborative projects, course work and theses · Enhancing your teaching by finding support communities and connecting to your research Taking a step-by-step approach to incorporating digital humanities tools into your teaching, the book is also supported by a companion website, including tutorials, sample classroom activity prompts and assignments, and a bibliographic essay for each book chapter.",2017-10-05
The Routledge Companion to Media Studies and Digital Humanities,Jentery Sayers,"Although media studies and digital humanities are established fields, their overlaps have not been examined in depth. This comprehensive collection fills that gap, giving readers a critical guide to understanding the array of methodologies and projects operating at the intersections of media, culture, and practice. Topics include: access, praxis, social justice, design, interaction, interfaces, mediation, materiality, remediation, data, memory, making, programming, and hacking.",2018-05-04
New Digital Worlds,Roopika Risam,"The emergence of digital humanities has been heralded for its commitment to openness, access, and the democratizing of knowledge, but it raises a number of questions about omissions with respect to race, gender, sexuality, disability, and nation. Postcolonial digital humanities is one approach to uncovering and remedying inequalities in digital knowledge production, which is implicated in an information-age politics of knowledge. New Digital Worlds traces the formation of postcolonial studies and digital humanities as fields, identifying how they can intervene in knowledge production in the digital age. Roopika Risam examines the role of colonial violence in the development of digital archives and the possibilities of postcolonial digital archives for resisting this violence. Offering a reading of the colonialist dimensions of global organizations for digital humanities research, she explores efforts to decenter these institutions by emphasizing the local practices that subtend global formations and pedagogical approaches that support this decentering. Last, Risam attends to human futures in new digital worlds, evaluating both how algorithms and natural language processing software used in digital humanities projects produce universalist notions of the ""human"" and also how to resist this phenomenon.",2018-11-15
